title,source_title,year,oa_status_2022_december,oa_status_2023_january,DOI
Place-Based Learning with Out-of-Place Species &amp; Students: Teaching International Students about Biological Invasions,American Biology Teacher,2019,Closed,"All Open Access, Green",10.1525/abt.2019.81.7.503
Simultaneous assessment of key properties of arid soil by combined PXRF and Vis-NIR data,European Journal of Soil Science,2016,Closed,"All Open Access, Green",10.1111/ejss.12320
"Message banking: Perceptions of persons with motor neuron disease, significant others and clinicians",International Journal of Speech-Language Pathology,2018,Closed,"All Open Access, Green",10.1080/17549507.2017.1356377
A comparison of nonobese versus obese emergency department patient satisfaction scores utilizing Standard U.S. hospital survey query methodology,"Journal of Emergencies, Trauma and Shock",2019,Closed,"All Open Access, Gold, Green",10.4103/JETS.JETS_114_17
Costs and Characteristics of Undocumented Immigrants Brought to a Trauma Center by Border Patrol Agents in Southern Texas,"Journal of Emergencies, Trauma and Shock",2019,Closed,"All Open Access, Gold, Green",10.4103/JETS.JETS_29_18
"Taxonomic status of the nominal forms assigned to Necromys lactens (Rodentia, Cricetidae) as revealed by molecular and morphometric evidence",Journal of Mammalogy,2020,Closed,"All Open Access, Green",10.1093/jmammal/gyz187
"Practical Singly and Doubly Electrophilic Aminating Agents: A New, More Sustainable Platform for Carbon-Nitrogen Bond Formation",Journal of the American Chemical Society,2017,Closed,"All Open Access, Green",10.1021/jacs.7b05279
Microwave synthesis of functionally graded tricalcium phosphate for osteoconduction,Materials Today Communications,2016,Closed,"All Open Access, Green",10.1016/j.mtcomm.2016.10.002
A roadmap to domain knowledge integration in machine learning,"Proceedings - 11th IEEE International Conference on Knowledge Graph, ICKG 2020",2020,Closed,"All Open Access, Green",10.1109/ICBK50248.2020.00030
