title,source_title,year,oa_status_july,oa_status_august,DOI
Individual identification patterns as a monitoring strategy for American crocodiles: Tayrona national natural park as a study case,Amphibia Reptilia,2020,Closed,"All Open Access, Green",10.1163/15685381-bja10033
Fair scheduling in high performance computing environments,Fair Scheduling in High Performance Computing Environments,2019,Closed,"All Open Access, Green",10.1007/978-3-030-14568-2
Backstage Staff Communication: The Effects of Different Levels of Visual Exposure to Patients,Health Environments Research and Design Journal,2020,Closed,"All Open Access, Green",10.1177/1937586719888903
"Rewriting carmen in pardo bazán’s insolación: Subversions of “race,” gender, and class","Intersections of Race, Class, Gender, and Nation in Fin-de-siecle Spanish Literature and Culture",2016,Closed,"All Open Access, Green",10.4324/9781315464855
Interaction between crack tip advancement and fluid flow in fracturing saturated porous media,Mechanics Research Communications,2017,Closed,"All Open Access, Green",10.1016/j.mechrescom.2016.09.011
Probabilistic prognostics and health management of energy systems,Probabilistic Prognostics and Health Management of Energy Systems,2017,Closed,"All Open Access, Green",10.1007/978-3-319-55852-3
The charlie Hebdo affair and comparative journalistic cultures: Human rights versus religious rites,The Charlie Hebdo Affair and Comparative Journalistic Cultures: Human Rights versus Religious Rites,2019,Closed,"All Open Access, Green",10.1007/978-3-030-18079-9
The Neuroscience of Mindfulness Meditation: How the Body and Mind Work Together to Change Our Behaviour,The Neuroscience of Mindfulness Meditation: How the Body and Mind Work Together to Change Our Behaviour,2017,Closed,"All Open Access, Green",10.1007/978-3-319-46322-3
